{
  "timestamp": "2026-10-16T14:02:18.070025+00:00",
  "asset_id": "COMPRESSOR-UNIT-01",
  "fault_prediction": {
    "predicted_class": "AIR_LEAK",
    "confidence_score": 0.9984,
    "probabilities": {
      "NORMAL": 0.9984,
      "AIR_LEAK": 0.0016
    }
  },
  "rul_estimation": {
    "estimated_rul_hours": 98.4,
    "confidence_interval_95": [
      92.1,
      104.7
    ],
    "health_index": 0.984
  },
  "explainability": {
    "top_contributing_features": [
      {
        "feature_name": "TP3_min",
        "shap_value": 5.964700222015381,
        "feature_value": -3.5995
      },
      {
        "feature_name": "TP3_mean",
        "shap_value": 1.1785999536514282,
        "feature_value": -3.3276
      },
      {
        "feature_name": "Motor_current_mean",
        "shap_value": 0.23510000109672546,
        "feature_value": 1.4666
      },
      {
        "feature_name": "Motor_current_max",
        "shap_value": 0.0544000007212162,
        "feature_value": 1.556
      },
      {
        "feature_name": "TP3_delta",
        "shap_value": -0.011800000444054604,
        "feature_value": -0.0512
      }
    ]
  }
}